{
  "schemaVersion": 1,
  "id": "prestige",
  "name": "Prestige Client",
  "category": "cheat-client",
  "description": "Cliente cerrado e inyectable para Fabric. Las cadenas provienen del usuario y no se han validado con muestras autorizadas.",
  "openSource": false,
  "loaders": ["Fabric 1.21 a 26.1.2 (inyectable) según su web oficial"],
  "references": ["https://prestigeclient.vip/"],
  "keywords": ["zprestige", "prestigeclient"],
  "falsePositives": [
    "La palabra 'prestige' es común; la cadena 'zprestige' sola es un indicador débil.",
    "Una coincidencia de cadena no demuestra que el cliente se haya ejecutado."
  ],
  "notes": "La web oficial lo describe como inyectable y de pocos cientos de KB, compatible con Fabric, Lunar y otros launchers: puede no dejar nada en la carpeta mods. No se encontró indicador con fuente primaria (investigación del 2026-10-20).",
  "indicators": [
    { "id": "prestige.entry-raw", "type": "string", "value": "dev/zprestige/prestige/api/mixin/MixinLightmapTextureManager.classPK", "strength": "medium", "provenance": "secondary", "validated": false, "source": "https://raw.githubusercontent.com/zeezyexe/zeezy-cheat-scanner/HEAD/src/scanner/MemoryScanner.cpp", "note": "Incluye 'PK' (inicio de la siguiente cabecera ZIP): se busca en los bytes en bruto del archivo. Aportada por el usuario y confirmada después en una herramienta SS pública: Mismo valor que el indicador user-provided 'prestige.entry-raw': puede pasar a 'secondary'.", "encodings": ["ascii"], "scopes": ["raw", "entries"] },
    { "id": "prestige.str.1", "type": "string", "value": "8}u6tWfJy\\", "strength": "medium", "provenance": "user-provided", "validated": false, "source": "Proporcionada por el usuario; pendiente de validar con muestras autorizadas", "note": "La barra invertida final es literal.", "encodings": ["ascii"], "scopes": ["raw", "entries"] },
    { "id": "prestige.str.zprestige", "type": "string", "value": "zprestige", "strength": "weak", "provenance": "user-provided", "validated": false, "source": "Proporcionada por el usuario; pendiente de validar con muestras autorizadas", "note": "Subcadena de prestige.entry-raw.", "encodings": ["ascii"], "scopes": ["raw", "entries"] },
    { "id": "prestige.package.1", "type": "package", "value": "dev/zprestige/prestige/", "strength": "strong", "provenance": "secondary", "validated": false, "source": "https://raw.githubusercontent.com/zeezyexe/zeezy-cheat-scanner/HEAD/src/scanner/MemoryScanner.cpp", "note": "Derivado de la cadena de zeezy 'dev/zprestige/prestige/api/mixin/MixinLightmapTextureManager.classPK' (línea 263), que es un nombre de entrada ZIP. Corrobora prestige.entry-raw (hoy user-provided)." },
    { "id": "prestige.string.1", "type": "string", "value": "prestigeclient.vip", "strength": "weak", "provenance": "secondary", "validated": false, "source": "https://raw.githubusercontent.com/ohsogalacy-del/OmniSS/HEAD/src/jvm.rs", "note": "Dominio oficial (Fabric 1.21-26.1.2, inyectable, según https://prestigeclient.vip/).", "encodings": ["ascii", "utf16le"], "scopes": ["raw"] }
  ]
}
